"You wouldn't want to take the air conditioning out, the car won't start up at that point - the battery thermal management system uses the HVAC system and it wouldn't be safe.

The Model S P90D is already traction limited to 60mph, so dropping weight probably isn't the answer to faster performance. Probably changing the wheels, tires, and tire pressure would help as well as the right track surface.
"
"F striker is all about close combat and high damage combos, F nen is about ranged attacks and support, f grappler is holds and crowd control. Out of curiosity, what level did you get your f brawler to, I have actually found mine to be quite a lot of fun most of the way through.

In terms of which of those is the most fun to level, for the average person its probably going to be grappler. Striker does not really become fun until you get lightning dance at level 40, and nen is probably going to be completely boring to you until you get a bunch of cube skills (what this will mean to you is different per player). I personally have enjoyed my f nen all the way through (currently sitting at 82), it helps a lot early on to supplement with sand splash and low kick, converting them to magic damage with the conversion option."
"Thanks to the despicable Judge Stephen Williams for explaining why our system of law is dog shit and our system of checks and balances is horribly broken in this document.

&gt;One judge in Friday’s appellate ruling went so far as to defend the NSA’s right not to reveal whether a plaintiff had actually been spied on or not. “Plaintiffs complain that the government should not be allowed to avoid liability simply by keeping the material classified,” wrote Stephen Williams. “But the government’s silence regarding the scope of bulk collection is a feature of the program, not a bug.”

Which should bring to mind an older, relevant document.

&gt;We hold these truths to be self-evident, that all men are created equal, that they are endowed by their Creator with certain unalienable Rights, that among these are Life, Liberty and the pursuit of Happiness.--That to secure these rights, Governments are instituted among Men, deriving their just powers from the consent of the governed, --That whenever any Form of Government becomes destructive of these ends, it is the Right of the People to alter or to abolish it, and to institute new Government, laying its foundation on such principles and organizing its powers in such form, as to them shall seem most likely to effect their Safety and Happiness. Prudence, indeed, will dictate that Governments long established should not be changed for light and transient causes; and accordingly all experience hath shewn, that mankind are more disposed to suffer, while evils are sufferable, than to right themselves by abolishing the forms to which they are accustomed. But **when a long train of abuses and usurpations, pursuing invariably the same Object evinces a design to reduce them under absolute Despotism, it is their right, it is their duty, to throw off such Government, and to provide new Guards for their future security.**"
"That is a pretty rude answer. He didn't say that he wants doyalst answers only that immediately banning people doesn't really help anyone. Have you considered instead of these sweeping ultimatums you ask the members of the community their feelings? I much prefer watsonian discussions but there are times dolayst information has a place as well. If we had a spoiler tag we could use to put that under it would be the best of both worlds. The information could be presented in the relevant location but those who want a purely watsonian argument don't have to be interrupted with it. Also there is no logical reason to ban meta discussion involving multiple settings. Again that leads to great discussions. Being a mod you can either work with the community or for yourself. Maybe you should consider what you want to do. "
"It's true that vaccines aren't 100%.  No medication or medical procedure is 100% safe.  There is a risk that some people's bodies will ""overreact"", similar to an allergic reaction.  It's extremely rare, but it is a risk.  There is also a slight risk if the vaccine was stored improperly and bacteria infected the vile (this happens more frequently today because anti-vaxx advocates pushed for eliminating preservatives from vaccines because of misinformation about the preservatives on the internet, particularly thimerosal).

&gt; Lastly, doctors are not scientific leaders. They take the position of being told what to do and are, from day one, under the control of the drug manufactures.

It's not just doctors that agree vaccines are safe, it's the entire scientific community, because the scientific evidence is overwhelming and there has never been a scientifically verified reproducible study that has shown there is a significant danger to any vaccine in use today.  Period.

Millions of people take vaccines, and people who take vaccines are no more likely to develop any type of condition than those who don't."
"I only played a handful of session, but honestly I never encountered any major issues with the rules as written. Though you could also pick up Deadlands reloaded and shift over to playing the game with the current edition of Savage Worlds. "
"I am testing the mods atm, will post my impressions here.

1. The armor plates mod seems balanced to me, not overpowered.

2. Azimuth's oxygen generators are 1x1x1, this is almost OP. I'd rather had them 1x1x2. Haven't tested the tank volume and the oxy generator performance yet.

3. I tested this wake bomb and fell in love with it. It's requires completely different approah to bombing, as well as skill and luck. Not OP but fun as hell. https://steamcommunity.com/sharedfiles/filedetails/?id=354194728

4. Azimuth batteries are, in my opinion, OP, as well as their ""fusion"" reactors. Totally destroys the balance, irregardless of the resourse cost.

5. The ""armored"" thrusters look much better, provide the same amount of thrust, and the additional ""armor"" is almost non-existent. Can take a couple more gatling bullets, so not OP, but look much better and should make it into vanilla game. **Large ship armored thrusters require to be adjusted to the latest vanilla game rebalance!**

6. RCS thrusters are very good, should be in vanilla game too. Excellent for precise docking maneuvers, useless for anything else.

7. Accumulators and capacitors are great and seem balanced to me! Accumulators work like batteries that can store more energy, but their output is weaker. Could be great for storing solar energy in bases and large ships. Capacitors are the opposite: very low storage, but can provide big current, thus compensating for intermittent overloads. I checked the storage and output values vs battery volume. The 1x1x1 mini battery is fine, but the slim battery is a little underpowered and needs to be adjusted.

8. Afterburner is a very interesting concept, although, the implementation could be better. I'd like to have those in the game, and I even considered making a similar mod myself, but there is already an existing one.

9. The solar batteries mod I suggested includes centered panels as well. I checked the power output vs surface vs the vanilla panels. Big ships panels provide exactly the same power/surface area, and the small ship panels are just slightly less efficient. I strongly suggest this mod, it provides great flexibility with the three additional panel sizes and the centered panels as well. Another great mod that should be in vanilla game.

==== to be updated ======="
"looks like a lot of standard consular gear tbh. i dont know anything specific, (sorry)you could try looking on tor fashion if nobody else gives a better answer than i  but you should have links to what he looks like for those unfamiliar with who you are talking about (like me)"
"If your energy is effected that severely, your daily calories are probably below your [Basal Metabolic Rate](http://www.myfitnesspal.com/tools/bmr-calculator). 


1. My BMR is 2064 cal/day, and I want to loose about 1.5 lb/week. 
2. I calculated my TDEE as 2477 (1.2 x BMR) since my job is sedentary. 
3. Now I want to lose 1.5 lb/week (1.5 lb/wk * 3500 lb/cal = 5250 cal/wk), but if I cut my diet by 750 (5250/7) cals/day to 1727 cal/day, I'd be below my BMR and very lethargic (like you describe). 
4. Instead I do about 2500 cal/wk of cardio and cut my diet to 2080 cal/day, just above my BMR.
5. My net calories per week is something like: (Food - TDEE) * 7 - Cardio = Deficit (2080-2477)*7-2500 = -5279 (close enough to my goal of 5250)

Hope this all makes sense! Let me know if you'd like another example with your numbers?
"
"&gt; I'm a pro-lifer and I don't consider myself a social conservative.

Well that's fine and dandy that you don't consider yourself one; you *do* hold a social conservative view on at least one issue. Patrick Brown holds many, including: his stance on sex ed, his stance on gay marriage (at least in the past) and his stance on abortion; ergo he is a social conservative."
"It's over half a century old. Wonka was most definitely *not* the villain. The story was structured more like an old fairy tale where naughty children who don't listen get punished and the sweet, innocent charlie gets rewarded with his wildest dream. Wonka clearly tells the children the rules, they disobey despite his warnings, and end up getting stretched out, rolled flat, bathing in rotting garbage, etc."
"Well it's important to remember we are all ""mankind"". Though Regular Masonry does not recognize Women in Masonry, we should respect thier mysteries. Heck you could even have a great Esoteric conversation with anyone outside the Craft, even women. Granted within the scope of our Obligation. "
"The ONDP targeted their messaging at blue-collar non-Toronto Ontario. The OLP successfully painted that as a move to the right, and continually claimed that they had produced the most progressive budget in history.

That's why the ONDP kept their vote and seat totals basically even, while seeing it shift away from Toronto. That's why people like Jonah Schein lost their seats. (Tellingly, it was the MPPs with unimpeachable leftist bona fides who survived, like Cheri DiNovo.)

The subsequent programme of the Liberals in government, however, has been radically neoliberal, stepping up attacks on unions and kicking the pace of privatisations into high gear. Anyone gullible enough to believe the hype about the OLP's supposed outlefting the ONDP has has learned the error oh their ways, and I don't think they're gonna fall for it this time when Trudeau tries it."
"&gt;Sure, the lump of cells might have started to grow into proto organs

Fully intact brains, hearts and livers.  My point is ... ""It's just a clump of cells"" is misleading in this case.

Women miscarry at the point that some of these fetuses are being aborted and experience extreme grief and loss.

http://www.medicinenet.com/stages_of_pregnancy_pictures_slideshow/article.htm

&gt;They found that until that thing could survive outside the mother (about 29 weeks) 

Babies have survived at 20 weeks.

Here's what I am saying to you ... we should test and weigh our opinions.  We should always consider what is and is not ethical.

Yesterday, a story made it to the FP of news and there was a comment saying, ""This is none of our business.  We should be able to take the fetus and make it into protein drinks and it would still be no one's business.""

I could only think:

https://en.wikipedia.org/wiki/A_Modest_Proposal

"
"It's mainly cheap. But some of their furniture is nice to look and has a distinctive European design philosophy that jumps out at you. It requires some DIY assembly, but that's part of the fun. Most people discount it as furniture for people who can't afford real furniture, but I disagree. There are some pieces (like their chairs) that are beautiful, comfortable, and quite affordable."
"I see so many cars and pickups towing trailers without tow mirrors, and as a truck driver, it's infuriating to see them get away with it. Those mirrors are not for your benefit, they're for the benefit of everyone else on the road, and help prevent accidents like this one, involving Trooper Wolf."
"Pleasant Valley version 2 would have won but it was rejected as it's not entirely new but an updated version of an already released mod.  The info to download and set it up is here: http://pvmods.enjin.com/home/m/31719950/viewthread/23968797-pleasant-valley-15-v20-info

"
"Innovation is rewarded well enough by the profits that come from successfully competing in a free market. The only additional reward that artists and inventors deserve is recognition for their respective contributions, not exclusive rights. Nobody deserves an exclusive right to anything beyond their own physical property."
"I don't think they are emotionally abused. Maybe repressed because they can't romantically explore.

&gt;desi kids really feel obligated to live up to their parents' expectations and keep them happy.

I can see this happening to her though. I honestly believe it would be better for her to either not date anyone who isn't Nepali or come out to her parents and say that she wants to date them."
"There are six (seven if you include Keira):

- the pellar near Blackbough
- alchemist near Oxenfurt Gate
- priest in Elector's Square
- alchemist in Rannvaig
- Gremist at Gedyneith
- priestess near Freya's Garden

EDIT: added list"
"I've been ""forgotten"" when I have been dining alone.  

I think it is either that they expect someone else to turn up and are waiting for them (then are too awkward to serve you anyway), or that they don't think it will be worth their while as you won't be ordering that much food and so they won't get a huge tip."
"There will be other people who live out of town too. Don't ask for any special consideration. You'll only find yourself frustrated when they say no and you'll be as perceived as being difficult or needy. 

Experience - Packer on late shift for three years."
"Dunno what to tell you man. Out of curiosity I just checked the names of all 13 people sitting on my floor. 5 devs, 3 support, 3 marketing, 2 sales. All of them had linkedIN profiles. I also managed the Biz-dev team for a while 3 years ago. It was a extremely rare when we didn't find a linked in profile. "
"Your second sentence pretty much explains exactly what this dream was about. ""Cars and mutilated dogs"" ""out of control with girlfriend"" is pretty straight-forward, if viewed through the dream-logic lens.

The second dream...Do you feel like you recently had a youthful part of yourself die? Have you had to deal with the death of a ""younger"" phase of your life?"
"The only time I was legit annoyed by something like this was how literally every chapter of Negima! on batoto has 7-15 pages of badly colored ""fanart"" *before* the chapter. The ""fanart"" usually being panels from the chapter you're about to read, so they often spoiled the chapter before you even get a chance to read it. And unless you have a script to read all of the pages in a strip you have no way to know how many pages you need to skip to get to the *actual* chapter."
"Enige vorm van racisme is een ernstig probleem. Als mensen zich niet prettig voelen doordaf ze beledigd worden om huidskleur, afkomst of geaardheid dan is dat een zeer ernstig probleem. Als wij dit afdoen als iets onbelangrijks dan is dat een enorm probleem, dat betekent namelijk dat wij het niet erg vinden als mensen zich gediscrimineerd voelen.

Als je het rapport van de VN leest dan zul je merken dat de VN niet op onderbuikgevoel af gaat. Dit is niet die groep van Verene Shepherd die ons met Zwarte Piet en ons slavernijverleden geld probeerde af te troggelen, dit is een serieuze werkgroep binnen de VN waar de Nederlandse regering zelf aan meedoet."
"I have been a huge fan of Ice T (and Body Count) for 15+ years.  (I am in my 30's.)  He has been notorious for being a gamer at least since resident evil came out for the playstation.  I am not surprised he opposes censorship considering everything I know about him.  "
"&gt;excellent at faceoffs

easy there... of the players that regularly took draws for the Stars last year he was the worst. Admittedly, the Stars were a good faceoff team, so that doesn't mean he was bad. And he improved a lot in the second half of the season, but he's got a ways to go before he earns ""excellent""."
"Like it or not, ""casual"" doesn't really mean that it is casual. It just means it's a place to play without risking your ranked rank. To some that can mean a place to play because they're new and scared of playing ranked. To some that can mean a place to try out ridiculous deck ideas. To some that can mean trying out tweaks to their top decks. To some that can mean a place to do your quests with whatever top decks they like. To some that can mean a place to learn or perfect the playstyle of some top deck. To some it can mean a place to play as normal when they have a questionable internet connection."
"They have a rad collection.

Not completely unrelated, but there should be one intact BW-388 in the Gulf of Finland. No one has found it yet but it should be there somewhere. It'd be neat if someone found it someday :3"
"Because a Google search for how to do Aetherial Reduction lead me here only to tell me ""Hey! you should do that thing you're trying to figure out how to do! gl buddy!"" ...Not OP's fault, but in case anyone else ran into this frustration...

Here's how you do it:

1. Find an ephemeral node. I farm furrymints in Twinpools W. Coerthas from 12a - 4a for example, but they're on a timer all over the new areas. [There's probably a guide somewhere.](http://ffxiv.consolegameswiki.com/wiki/Ephemeral_Nodes)

2. Switch on the Collector's Glove action before digging/hacking. It's in your actions list.. the hand by the square/pyramid thingy. It's a permanent thing that stays on.

3. Here's where I was getting confused. Click your furrymint or whatever and it will go to a screen with a 30/30 and it won't let you do jack (which was the point I started doing Google searches and found this thing about how awesome the thing I can't do is)

4. Don't do what I did instead do this.

5. Hit the skill Discerning Eye. Why? Still don't know. Just do it.

6. Now you can hit Utmost Caution skill and maybe some other stuff... again I still don't know what's going on, but it works :p

7. After hitting these cool skills you've had for 2 months without a clue as to what they did you can use ""Methodical Appraiser"" --which is the gather this stuff skill. You'll get something collectible woohoo.

8. Repeat that stuff till the node is empty. 

9. Go to your items, and now those collectibles will give you the option to Aetherial Reduce them.

I know nothing about how to get the best stuff, what the actions do, but it's a start, and it's better than yelling at Google for taking you here for an hour. gl."
"&gt; the typical rider puts 100 miles on his bike per week for a total of about 5000 miles.

In the US?  Source?

&gt; 5000 X 15=75,000 miles and that's billions and billions of in-and-outs for the pistons and rings.  I wouldn't be a bit surprised if an engine with that many miles on it burned some oil between changes.

It doesn't have that mileage, I absolutely guarantee."
"That's what I don't get too. It's as if OP and the retard in the thread didn't know that only Canada and Mexico have a leaf or leaves on their flags.

All the others either have either entire trees, or branches (olive branch being apparently the most popular). And by all the others I am talking about 6 other flags.

tl;dr; OP is a faggot, and the Australian in that thread was a faggot with OP"
"### **[Dredd (2012)](http://www.imdb.com/Title?Dredd+%282012%29)**

Action, Sci-Fi [[USA:R](https://en.wikipedia.org/wiki/Motion_Picture_Association_of_America_film_rating_system#Ratings), 1 h 35 min]  
Karl Urban, Rachel Wood, Andile Mngadi, Porteus Xandau  
Director: Pete Travis

**IMDb rating:** [](#movieguide_stars)**&amp;#9733;&amp;#9733;&amp;#9733;&amp;#9733;&amp;#9733;&amp;#9733;&amp;#9733;&amp;#9734;&amp;#9734;&amp;#9734;** **7.0**/10 (184,999 votes)

&gt; In a dystopian future Earth, the area between New York and Boston has become a crime-ridden urban mass of 800 million people known as Mega City. Keeping the peace are combination policemen-judges who make the arrests, determine guilt and then execute the sentence. Judge Dredd is among the best at what he does and he is assigned a rookie, Cassandra Anderson, who did not meet the minimum requirements for the job but who has one talent most do not\: she is a mutant with psychic abilities. They soon find themselves inside Peach Trees, a 200 story building that houses among many others Ma-Ma a gangster who produces the drug of choice in Mega City, slo-mo. Ma-Ma shuts the building down determined that Dredd and Anderson will never again see the light of day.
(*IMDb*)

**Critical reception:**
&gt; The film received positive reviews from critics. On Rotten Tomatoes the film has a rating of 78%, based on 147 reviews, with an average rating of 6\.5\/10\. The site's critical consensus reads, ""Fueled by bombastic violence and impressive special effects, rooted in self-satire and deadpan humor, Dredd 3D is a rare example of a remake that actually works."" On Metacritic, the film has a score of 59 out of 100, based on 29 critics, indicating ""mixed or average reviews"". CinemaScore polls reported that the average grade moviegoers gave the film was a ""B"" on a scale of A\+ to F.
(*Wikipedia*)

More info at [IMDb](http://www.imdb.com/Title?Dredd+%282012%29), [Wikipedia](https://en.wikipedia.org/w/index.php?curid=28882162), [Rotten Tomatoes](http://www.rottentomatoes.com/m/dredd_3d/), [Metacritic](http://www.metacritic.com/movie/dredd), [Freebase](http://www.freebase.com/wikipedia/en_title/Dredd).  
*I am a bot.* [Send me feedback](https://www.reddit.com/message/compose?to=%2Fr%2FMovieGuide&amp;subject=Re%3A%20http%3A%2F%2Fredd.it%2F3irxuf ""Confidence: 1.08""). [Data sources and other information](/r/MovieGuide/w/about).
"
"I'm not sure what you mean when you say that's ""the"" point. It's obvious to most people that, if a child is drowning in front of you and you can save them with no risk to yourself, you have a duty to do it. And the article's author seemed to agree."
Of course they have discussed it. His entire job is to manage this roster of players. Their star acquisition is slumping hard and you don't think they would even talk about possible ways to address that?
"This is so true. I live in South Carolina now but I'm from Tampa Bay. I know I live an hour and a half down the road from BoA Stadium, but I have yet to see a die-hard Panthers fan. The Bucs went 2-14 and have been constantly struggling for a while but the fandom still seems to have some...pizzazz I guess would be the word. There just seems to be something much more interesting about the Bucs than the Panthers. Maybe it's the pirate thing or the fact that the Panthers win a decent amount of games meanwhile when the Bucs win one its like the greatest week of your life"
"[**@speaktochris**](https://twitter.com/speaktochris/)

&gt; [2015-08-28 21:01 UTC](https://twitter.com/speaktochris/status/637369480872611841)

&gt; .@rallat  Ah! bummer you couldn't make it!

----

^This ^message ^was ^created ^by ^a ^bot

[^[Contact ^creator]](http://www.np.reddit.com/message/compose/?to=jasie3k&amp;amp;subject=TweetsInCommentsBot)[^[Source ^code]](https://github.com/janpetryk/reddit-bot)
"
"She smiled as his hand large hands traced gently over her much smaller ones. ""So is it like drinking too much wine or ale? I've been known to fall asleep after having too many cups on occasion."" She giggled, seaglass eyes staring up into his green ones, her fingers curled gently around his hand, as if it claim it for her own."
"[**@kpapametal**](https://twitter.com/kpapametal/)

&gt; [2015-08-28 07:49 UTC](https://twitter.com/kpapametal/status/637170073740910592)

&gt; なんとフランクフルトではほとんど見れたベビメタのVIDEOがベルリンでは4つしか見れない、MVはギミチョコとドキモだけ、この２曲が異様に盛り上がったのはこの辺も影響してるのかな？同じドイツ国内で何故こうも違うの？　\#babymetal 

&gt;[[Attached pic]](http://pbs.twimg.com/media/CNeuzhbWsAA9-nm.png) [[Imgur rehost]](http://i.imgur.com/GehyQ3H.png)

----

^This ^message ^was ^created ^by ^a ^bot

[^[Contact ^creator]](http://www.np.reddit.com/message/compose/?to=jasie3k&amp;amp;subject=TweetsInCommentsBot)[^[Source ^code]](https://github.com/janpetryk/reddit-bot)
"
No Chris the Vice President was made president when Prioma stepped down.  Then he invited me because I said I can help him when he got griefed.  Then he made me Vice President without me even asking.  Don't make up stories.
"Marshall Center is one possible place; lots of study areas scattered throughout, as well as the 4th floor, though if you need quiet, you want to avoid the 4th floor.  Another place is the Engineering building, specifically the ENB lobby (called the Hall of Flags), aka the Fish Bowl.  If you get there too late the doors will be locked, but it's likely someone will be in there to let you in."
