"I joined a new league this year and they have different scoring rules than I'm used to. It's a slight PPR league- .2 PPR. Standard besides 1 points for 15 yards receiving, .2 points per completion, 6 points per TD thrown, and some bonuses for rec/rush/pass yardage. My question is, is it wildly clear that QB has the highest potential for points? I put in the rules at a ranking site and noticed that top QBs had 300 points more than the top RB/WR. Would it be dumb not to grab a QB in the first round?"
"In your scenario, a person could just not run the mandatory background check on the buyer and still sell the gun to the felon. There's no way to enforce it. An honest seller is going to not sell the gun to them when they see they're a felon on the background check. A dishonest seller isn't going to run the check in the first place. No one is going to be honest enough to run the check, see they're a felon, and then all of a sudden immediately turn dishonest and say ""nah, you know what, here's your gun anyway."" They wouldn't run the fucking check in the first place, genius. Your bullshit proposal is **NOT ENFORCEABLE**. This is why people without 

&gt;Here's an idea, why not make a background check system where it would be illegal to sell guns to felons? That doesn't convince you? IDGAF.

We already fucking have that. What aren't you understanding about this?! It's just currently not available to private sellers. I'd like to make it available, but there's no point in making it mandatory.

&gt;You're just supporting it to make a gesture towards background check reform in bad faith.

As a gun owner who has harmed no one and has constitutionally protected rights, I actually don't own the anti-gun side a damn thing. It's people like you that convince me to not give an inch at all. I'm wiling to extend NICS to private sellers as voluntary. Take it or leave it, because it isn't going to be made mandatory. Not gonna happen. Period."
"They don't get paid for how much time you spend building your army. They get paid when you gem it. Having a premade layout saves what, 30 seconds? During that time they've made $0 and still have the ability to make $X if you decide to gem it. "
"I dunno, back before the August update in an A+ lobby for Tower Control in Saltspray Rig, I remember the enemy team barraging us with bombs in a suspiciously coordinated fashion.  And my teammates were also tossing bombs left and right.  Non-stop splat/suction/burst bombs.  Bombs, bombs fucking everywhere.  It was terrifying having to dodge one after the other.  It never ended, and some of them even had bomb rush to toss even more goddamn bombs.

I think I still have PTSD of that horrifying event.  That match really felt like a Michael Bay movie."
"No, but Toriyama sometimes would draw himself as a little robot. Shen was a funny character for a few episodes(hitting Yamcha in the junk) before you find out his true identity. Then he has an awesome fight with Piccolo."
"Implement some form of tenure for mods and require a majority vote to remove any tenured mod. Only allow mods to trigger a removal vote on mods lower than them in the hierarchy however.

This removes the possibility of a single mod (such as an absentee top mod) swooping in and blowing up the sub but doesn't create opportunities for hijacking. Importantly, it also doesn't require rejiggering the existing mod hierarchies or ongoing admin involvement in dispute resolution."
"I hate reading shit like this because you sound like such a catch before or after you started working out, and your husband takes you for granted.  What I would do to be with someone like you.  I'm not going to tell you to stay or go but whichever you decide, just don't lose sight of how you deserve to be treated and don't put up with anything less."
"&gt;Baltimore County prosecutors will speak to the victim's family before deciding whether to charge Shattuck, reports the station.

Earlier the parents said: 

&gt;""What she did to my son is heinous. The fact that she paraded her pedophilia in front of her own son is even more disturbing,"" the mother said. ""Any adult who rapes a child deserves to be in prison. Please hold her accountable.""

It seems like they probably will ask that they send her to prison. I hope they do. Honestly that judge basically gave the green light to any adult woman to molest little boys free of consequence in the future and that's simply not acceptable. 
"
"I think you might be missing my point. A gun is a tool which allows you to kill very efficiently. Not having those around means there's less chance for people to make dumb decisions which end up in deaths. I'm not concerned with spree killers or other people who plan to kill, I'm concerned with people who wouldn't otherwise put other's lives at risk when they get angry, but there's a gun at hand. The latter is vastly more common than the former."
"Thank you for the Giveaway OP! I would like to enter for The Elder Scrolls V: Skyrim.

I played it at my friends house but haven't been able to get it yet! I thank you again for this giveaway. Good luck everyone!"
"Im Dutch and have watched all Netherlands games for the last few years, Nigel de Jong has been solid during the WC and before and I see no reason at all not to include him since we don't have any non attacking midfielders in our team other then Anita (which I don't really rate) and Blind (who we'll probably need as LB). Tete hasn't even been that good in the eredivisie IMO, so why put him ahead of a expierenced player in the Dutch squad like Janmaat is beyond me.  We don't have a real LB in the squad, only Blind and Kongolo (who didn't play well in a weak eredivisie last season) so that's why I would include Pieters.
   I'm not making assumptions here. I agree that our defense hasn't been that good, that's why I don't get why we don't use Nigel de Jong, that's why I wouldn't use young unexpierenced players like Riedewald and Tete. These matches are super important, we won't qualify if we don't win them, so if you want to experiment with other players I would always use more expierenced players and not players who played with each other before instead of new ones like Tete, Riedewald and Anita. "
"Don't


Just take them before/after.


I take PreparE before going out and RecoverE on the come down and my rolls have always been pleasant and my comedowns minimal.  Both can be found on [ravesafer.com](http://www.ravesafer.com)


If you really must take some in with you, the PreparE pack only has 3 pills in it (all of the supplements are combined into these 3 pills), so it's far easier to get them into places than having all the supplements separately.
"
"&gt; Key word there is ""were"". As I nodded to when I said ""Yeah, back in 1960"".

Which is what I referred to. I pointed out the *history* of the use of nullification logic.

&gt;Guess what? This isn't 1960. It's 2015, 

And so what? So people don't have bad idea? A bigot won't use the same logic to refuse to convict? If it is OK to say ""I won't convict on a drug charge"" it is OK to say ""I won't convict on a rape charge"".

&gt;you're playing on a stereotype from nearly 60 years ago as if it were a true today.

And you have completely misunderstood what I wrote and my point."
"&gt; I'd really like to see if anyone has ever used it.

[Here's](http://thefreethoughtproject.com/indiana-law-force-cops-overturned-mans-battery-officer-charge/) a case where a man slamming his house's door against an officer's foot was deemed legal because the officer didn't have probable cause to investigate his house.

&gt; But the appeals court reasoned that, “Constable Webb had entered Cupello’s apartment without consent, probable cause, reasonable suspicion, or exigent circumstances. Because Constable Webb resisted Cupello’s subsequent attempts to close the door, Cupello had a reasonable belief that force was necessary to terminate Constable Webb’s unlawful entry into his apartment.”"
"Shane o'mac vs Brock Lesnar 

No DQ

Obviously Shane would have to be younger and this would be first run  Brock when he wasn't being pushed as basically unstoppable

But I don't think anyone dishes out punishment better than Brock

And I don't think  anyone makes getting the crap kicked out of them look as good as Shane O "
"I don't see anything like that on the wiring diagram.  Doesn't mean its not there but I never heard of it.  The first gen bikes have and accessory wire in the fairing that can be used for low draw devices like a cell phone or gps. 

Installing a 12v outlet isn't very difficult.  Are you used to working on bikes or with electric wires at all? "
"I think *M* is one of the most interesting early sound films. Fritz Lang really made incredible use of sound, especially for a director who had predominantly done silent films at the time. Much of the film is completely silent which adds to the suspense for me and the anxiety that the film creates. There's never really a wasted sound clip, every line of dialogue is extremely important. Even Peter Lorre's whistling is integral to the plot."
"This is Zen as it is found outside of /r/zen. Zen flesh, zen bones. This place doesn't fill bellies the same way. And since you never stop by to have lunch your criticisms are again unfounded and somewhat laughable. Why don't you stop by for tea? Ask questions to your heart's content. Finally learn to cook! My teacher is very fine."
"The game is very good, but the style of it doesn't lead to paying attention to the storyline or the environment. Which is a fault of the game as it doesn't reward you in game with anything for exploring, except small acknowledgements. "
so would it technically be possible to write down all our physics equations on scratch paper during the tutorial and then use that same scratch paper (with the equations) during the chem/physics section since it's the first section? bc that would be super great...
"I recommend [Intimacy and Desire](http://amzn.com/0825306299) by David Schnarch.  An excellent read, and a very thorough discussion of the problem of unequal desire in long term relationships.

[Mating in Captivity](http://amzn.com/0060753641) is also very good, but focuses more on lack of desire rather than unequal desire."
No. PL has more teams in Europe than Italy = PL teams can make more points than Serie A teams. PL will only lose its 4th CL spot if all English teams lose and all Italian teams reach Semifinals/Finals. So: No.
"Start reading about cubes. Do that for a few months, then you'll have a better idea. 

People don't just build them without knowing anything. We get into it after months of reading about cube building theory, reading lists, etc. Start along that road. "
"Yeah, no. That's not the way politics work. You don't elect someone who has no plan and then pray that he'll figure out a way to get it done once he's in office. You're basically electing someone on a promise they may or may not keep, which I thought was what Sanders' campaign was against. At least candidates like Clinton or Bush have the political muscle to get what they say done. "
"I think this is something that escapes a lot of people.  It's not about who was in the right or who was in the wrong, it comes down to everyone staying safe and going home in one piece at the end of the day."
"I wouldn't say pointless. It can help with all other victory types. Source: http://civilization.wikia.com/wiki/Tourism_(Civ5)

Science from Trade Routes: Cultural influence with a certain nation increases Science output from trade routes established with them. So, boost your research by opening Trade Routes with nations you're influencing culturally!

Espionage: Your spies become more effective in nations influenced by you culturally. They will take only one turn to establish surveillance in their cities. Higher influence status also makes them operate as if they had already been promoted.

Conquest: When you capture a city belonging to an enemy influenced by you, Resistance in that city will last in fewer turns. Also, the city will lose fewer citizens upon capturing."
"Love that song. Maybe it's just me being weird (spoiler alert: it is), but I always imagine the narrator in that song singing it to himself. Or even, it's a buddhist-type thing and the it's the concept of ""you"" itself that's bad and needs to die.

I like to think too much :)"
"For some people, it *is* a constant lifestyle. Some people have kinks that are informed by their interests in the fandom. (""Perversion"" is a strong word that I don't think applies to most of them, which may be odd, but are harmless.) For most though, furry is largely about the appreciation of the anthropomorphic aesthetic. Here's a couple links.


https://www.flayrah.com/4117/retrospective-illustrated-chronology-furry-fandom-1966-1996


http://www.hoodedutilitarian.com/2015/01/you-cant-get-inside/"
"He's actually very fun to play as if you understand the game. he also has counterplay, but people like yourself are too ignorant to figure that out and instead just say he's badly designed just because you dont put any thought into it.

Truth is Yorick is well balanced, he's just old and unpopular. thats why he's last on the rework table; because he isnt detrimental to the game and not enough people play this champ."
"The thing is that third-tier classes weren't really any different than the second-tier versions they replaced. They just hamstrung the second-tier versions a bit and boosted the stat caps, reserving things like signature skills or a second weapon type for third-tier instead."
"The Centra players agreed to this last season, and had no problems with it when it was played through. 

It basically becomes Midwest vs. Northeast/Europe for Radius. Sphere is West vs Southeast. And Origin is whoever can play on it best. It works out. 

And your USC team has beaten my USC team on Radius in the past, so I think YAC and BigBird will be fine, lol. "
"Yea, but if it does ridiculous amount of damage guaranteed, which it will, then, if you haven't won the game with that drop you will win with speedlings. It worked too reliably, there wasn't enough incentive to not do it."
"Whenever I see what would normally be a good deal advertised to me, I just dismiss it as a scam. In my mind at least, every single ad I see is a scam. Now, If I'm looking on Google and I come across a website on my own with that same good deal, I'll be all over it. But if I come across it as an ad, nope."
"I was in the same boat, I'm going into first year uni now and felt left out when most of my friends had their license. I remember I was scared as hell as the test date was approaching because I didn't want to fail and most of my friends got their license first trial too. What helped me was a lot of practice, I used to get my dad to take me driving for hours multiple times a week and get really comfortable driving. So when I did my test, all my anxiety and nervousness was gone because I was so comfortable with driving at this point. Good  luck!"
"the 8 damage is great to help close out games or even to help remove the board. tech cards just add unneeded variation, even though rag is an rng based card, its value is always consistent in any match up."
"Not often, I mostly go by what their fans say about him and reading stuff like this http://www.espnfc.co.uk/club/internazionale/110/blog/post/2476665/mauro-icardi-of-inter-milan-deserving-of-scoring-honour"
"Verratti is a great enforcer. Vidal is enough of a player to dominate a midfield the way Iniesta can't. 

What I am saying is that each and every team bar Pep's Barça had to rely on a strong physical midfielder to win. Busquets, Marchisio, Pogba, Rakitic are strong, they are not small, elegant technical players. The big discussion was about Arsenal - and Arsenal don't have that physically imposing midfielder other teams do"
"It's why these ""roles"" that Smite have are really fucking annoying when more unique gods enter the game. Dota technically has roles but everyone ignores them and plays each specific hero to the best of their ability, buying the items that work best for that hero and putting them in the lane that benefits them and their team the most. Smite  gods are lumped in the different pools where roughly the same items are bought, with roughly the same playstyle and are put in roughly the same lanes, with few exceptions."
"Unfortunately, your post has been removed due to having a very short title. Titles do not need to be overly long, only about an **average sentence in length** (7 words) but substantial enough that someone else can understand without having to see the full post. A specific question will attract more attention than a general one.

Rule of thumb: **If your question can fit in the title (&lt;300 characters), then it should be in the title.** [You can find examples of other titles not to use **here**.](http://www.reddit.com/r/PS4/wiki/subreddit/rules/examples#wiki_vague_titles)


*I am a bot, and this action was performed automatically. Please [contact the moderators of this subreddit](/message/compose/?to=/r/PS4) if you have any questions or concerns.*"
"Thank god we as a parliament don't have to suffer the humiliation of putting the decades and centuries of British tradition and our monarchy to a vote. I'm delighted that such a treacherous bill has failed to succeed. 

*God save the Queen*"
"I was at a camp for a few days, so I apologize that this is so late, but if you haven't already found out yet, slacker is an online radio service, kind of like Pandora or something, from what I understand. They have the next releases up sometimes because they're preparing for when they're actually unlocked. They're in the service, but not able to be listened to, kind of like how spotify has releases up a day before they're out, but you can't listen to them."
"Pretty much, yes. You won't be able to cover a huge amount of ground in just 6 days. You can fly into Sydney, spend a few days there, then fly to Townsville or Cairns and do some trips out to the GBR before flying out. Or do Sydney, Melbourne, GBR. 

There are subreddits for both Townsville and Cairns so you can get some specific information from there as well as printed guides like LP.

That's just my 2c worth - others may have other suggestions for you to consider. 

i'd focus on Queensland if you are after the warmer weather. 
"
"Trump's appeal has nothing to do with tax cuts for the wealthy and you know it dude. He's only recently said something along the lines of being fine with his own taxes going up. 

His appeal is about immigration, that is what started it.

You cannot compare the zeal with which the Republican base supported every other tax cut of he Republicans and say they are ""sick"" of it. They regularly attack Democrats for suggesting raising any taxes."
"Yeah it's always easier to criticize but I think the silent mass that appreciates pansy is bigger than ""99 percent of the community"". I personally like her cast, it's pretty cool when she starts whispering imo. "
"Quick google shows that these are most of the [soul effects](http://www.basilmarket.com/forum/2815322/0/Gms_Soul_Weapon_Compilation_Thread.html). It's all dependent on what kind of effect you want really. In terms of summoning or buffing. I prefer summons since they actually do really decent damage and clear maps very well if you have an acceptable range. Therefore, Murgoth is probably the best summoned soul or magnificent Magnus (which is also a summon). Prefixes usually determine what type of stat they will have. So for example A **clever** ""soul"" will provide the int stat or a **potent** ""soul"" will provide attack damage. Specifically for a xenon you probably want a **flashy** soul since it gives an all stats boost if you can't manage to find/buy a magnificent soul."
"Your last sentence there is just antithetic to the rules here and we won't allow you to make a habit of doing this.

You can talk to people. Please don't accuse them of stuff, project stuff on them, or presume the worst about them and respond to them as if they actually did that. There's no discourse in this, that's just attack, and it's not allowed.

Any list of people who do this here would place you at or near the top. You need to do better, please, and now.
"
"The first version, was the rough prototype.  The 2nd version is based on feedback from the original backers, and all original backers have been written into the game, either as characters or in events.

Included in the changes, a content writer who went through the events and changed them to fit thematically, and the mechanic for how events where drawn was completely scraped and redone to fit in with the theme of the game."
"I didn't say it was shit, I just said it wasn't of professional quality and wasn't worth the $300.00 you were asking for it.  I also provided an image of a knife that I did consider to be professional quality  and which was worth the kind of money you are asking.

The think that gets me is that you posted here asking if your knife was worth $300.00, your friends told you it wasn't, I told you it wasn't and explained why, and you get all huffy about it.  If you don't want the opinion of people more knowledgeable than yourself, then you shouldn't ask for it.  "
"from reading that it sounds like he's having trouble learning the defense.  ""flying around"" and ""reckless"" to me = not having to think, just react and play football. 

if he isn't flying around it's probably because he's not certain of his assignments all the time. 
 "
"Exactly! I am always thrown by this argument as a debate on why Utah *doesnt* kick ass. 
The laws *are* inane and illogical, but hardly more than annoying when compared to the positives. Using them as a core base of why to avoid Utah seem like an over dependence on the need for alcohol. "
"Ive been at tis for two decades, and youre goddamn right youre a bandwagon jumper.  You dont know shit about the MRM, the philosophies behind it, the basis of the issues, or any of that.  And on the subject of activist strategy, i can tell you you are an outright moron, adopting the narratve fed to you by making you fear 'looking bad'.  Im gonna bet you 100 bucks you know sweet fuck all about Game, Roosh V, ROK, Red Pill, or any of the other shit you so sanctimoniously warn people away from.


Seriously, you have your head right up your own ass.  So much so, im betting you dont even attempt to outline your objections.  Just like every other SJW asshole when asked for specifics."
"I think youtube videos of beauty gurus using bb cream got me into AB? Bubzbeauty reviewed some AB stuff. I used to watch a lot of makeup tutorials in middle school but I never really looked into it until high school~ 

Oh and I also had a Korean friend with FLAWLESS SKIN that I really admired. ..though she didn't use any AB products, heh, just genes~ "
"I like people like you. Most people say having pride is a bad thing, but I know too many people that have no pride and are complete bums.

I have relative custody of a kids who's father hasn't had a job in years, has three kids, and the government pays for literally ALL of his expenses. He is completely healthy and just smokes spice all day. 

Sorry for going off topic. You're doing good and I truly wish you the best. Just keep swimming."
"I mean, there's another way to look at it as well. You're upset because you bought baby gifts for your friends and they haven't reciprocated. But they threw a party and invited you, and *you* haven't reciprocated. What's the difference, really?"
"tweet @pgh311 and they should get back to you with a ticket number. theyve been speedy with my requests when banksville ave was a hot nightmare. 

*if you don't tweet, give me street and block and ill tweet at them for you"
"The EAP should have been made out to the beneficiary. The advisor that withdrew the original 5000 circumvented the requirements that the beneficiary receive the EAP as it may contain some portions that are taxable under the beneficiaries name. The other 2 types of withdrawals such as a Educational capital withdrawal and  non-educational capital withdrawal are withdrawn under the subscriber's name as again, they will be taxed on any investment income as this isn't a  sheltered account.

At the end of the day, this seems like a helicopter mom who wants to make sure you don't spend the money on non-school related items.   "
"Just did a quick test and it does work for me. The issue is most likely on your side.

    var vapor = require('vapor');
    
    var client = vapor();
    
    client.init({username: 'xxx', password: 'yyy'});
    client.use(vapor.plugins.declineGroupInvites);
    client.connect();"
"Perhaps you have both files in different instances of Excel (you started Excel 2 times and have one file in each application), if that's the case I think that when you paste, it will only allow you to paste normally, not giving you any paste special option. Close all the Excel Files and make sure you have both opened on the same application."
"If you're going to do this, get a teacher and do lessons weekly. At least half an hour. My teacher charges 40/hr 20/half, and I have to say I don't think I'd be nearly as good or nearly as dedicated if I wasn't taking lessons. I've been playing for ~5 months and I feel like I have a decent tone. Nothing mind blowing but it doesn't sound bad. It would've taken me so much longer to get to that point if I wasn't doing lessons an hour a week.. 

Also, just fucking practice. Every day, no less than 30 minutes a day. Skipping a day here and there isn't the end of the world, but stick to it."
