"#### Sorry JetJavelin, your post has been removed: 

&gt; Rule 2\. ""We welcome **discussion-promoting** posts that benefit the community (device reviews, guides, discussions and rumors) and not the individual (support questions, rants, customer service complaints, selling/trading devices, etc).""
&gt; [See the wiki page for more
&gt; information.](http://www.reddit.com/r/Android/wiki/rulesandregs#wiki_2._we_welcome_discussion-promoting_posts_that_benefit_the_community.2C_and_not_the_individual.)

You may be interested in:

- /r/AndroidQuestions - General queries.
- [Your device's respective subreddit](http://www.reddit.com/r/Android/wiki/subreddits) or [xda-developers.com](http://forum.xda-developers.com/compact) - Device-specific queries.
- /r/PickAnAndroidForMe - Device recommendations.
- /r/AndroidApps - App recommendations. 
- [The AOSP tracker](https://code.google.com/p/android/) - Reporting Android bugs/feature requests.
- [eBay](http://www.ebay.com/), [Swappa](http://www.swappa.com/), [craigslist](http://www.craigslist.com/), or /r/hardwareswap - Selling, buying or trading devices.
- Additionally, you might be interested in joining our IRC channel 
- *irc.snoonet.org #android*. If you're accessing this from a web browser,  you can join us in an in-browser client [here](https://kiwiirc.com/client/irc.snoonet.org/android).

If you would like to appeal, please [message the moderators by clicking this link.](http://www.reddit.com/message/compose?to=%2Fr%2Fandroid)

---


*I am a bot, and this action was performed automatically. Please [contact the moderators of this subreddit](/message/compose/?to=/r/Android) if you have any questions or concerns.*"
"i don't need to re-read your comment where you misunderstand the proposition and suggest that it would be *less* confusing to provide a completely separate keybind that duplicates the function of something that could be handled by one key with a 3rd option. i already read that stupidity and understood how wildly off base you were - that's why i stepped in to call you insane.

your solution is to provide ANOTHER ball cam key... lol. PSYONIX PLS HIRE THIS GUY FOR GREAT CROSS PLATFORM UI/UX."
"From the male side. Dating another INTJ is a very unique proposition. Being with a woman you can respect for her brain and character is something not many men get to experience. There is immediate understanding, ability to work through issues with nearly no effort, and discussions almost always end with the satisfaction of having found a solution.

There are only 3 things to check, from my experience and reading comments here and elsewhere: 

(a) are both people mature enough to enjoy investing in the relationship and dedicating it some time? If not it will fizzle out.
(b) are both people stable (i.e. no personality disorders)? - INTJ life is hard, many of us carry baggage which can be destabilizing; baggage which is transparent until the moment one gets into an intimate situation with another person and there are feelings on the line.
(c) is there limbic system attraction and can it be sustained. This involves both taking care of the looks department (very hard when you are in the middle of a project) and also just having some traits particular to your gender that keep the lower brain layers of the other person ""on board"" with the plan. Possibly in (c) there is a lot of variability, going from people who couldn't care less about anything other than intelligence (mostly INTP-land), to people who want a more complete package (towards ENTJ land). "
"The Seattle Opera has these.  They're at the back of the upper balcony so the view isn't great, but the speakers mean you can at least hear just fine, but no one can hear you.

I know this because if you feel sick they'll let you use them as well, especially since very few people bring kids to the opera in the first place.  That way you can cough or moan and not bother people who paid $600 for their seats or what-have-you."
"&gt; They did it without paywalls and also without excessive tracking and advertisements.
&gt; 
&gt; 
&gt; 
&gt; Then Google came in

Youtube did not have advertising (or even revenue) until *after* google bought it. They were a startup quickly burning through cash, and google bought them for the audience and tried to make it sustainable. "
"I'm not sure - I only know that a while back I tried to link to the Express (to point out how terrible it was) and my comment was auto-deleted. Which is probably why this post links to an archived version, rather than the page itself."
"It will likely go on to your final destination.

If you bag arrives in the final destination airport before you,  it will be in baggage claim then put back somewhere.  You'll need to claim it though an office.  "
"H blademaster is generally pretty bad for assa, I'd suggest grabbing normal class trinket/ heroic censer if those are available to you. Now that you have 4set, your uptime on envenom should be extremely high, specially during execute phase, so you'll definetly see a significant increase in dps on certain fights (gorefiend, tyrant, etc.). 
Now, to the logs: On the reaver kill your popped your CDs before bloodlust. Again, I've said this today, this is only a small dps loss for rogues compared to other classes but it is still a dps loss. I do however believe this was due to lust being popped late and not you misplaying, but do keep this in mind. 
About combat, I do suggest using blade master + soul cap on iskar and xhul like i said a couple comments earlier, tho I'd use soul cap + class on advanced trash. I wouldn't play combat on council, specially considering your OS is assa, which is even better than sub for council. Combat is probably the worst spec, it's all ""fluff"" damage since gurtogg is the real prio. Hope it was useful advice, your logs look solid overall. 
"
"That's the most ridiculous thing I've ever heard. I don't care about the aim assist but holy crap I like to play on high sensitivity so I can have an advantage on other players but I can't do that when this bull shit sniper scope moves around so damn fast. "
"Dragon Quest VI... It's okay. I've been marathoning the DQ series for the first time, and was really excited to get to VI since it brought back the vocation system. I'm having fun mixing abilities onto characters...but the story so far has been utterly boring and confusing. None of the characters are very interesting either. Coming off of V, this is a big let down. Otherwise, I'm still kinda having fun exploring stuff and I think that's what DQ does best; gives you a semi-open world to explore.

Xenoblade Chronicles (Wii)... I've needed to play it for a long time and I'm finally making my way through it. I really want to give this game a 10/10 because of the spectacle of it all; it can be breathtaking...but I can't. The story is a bit slow right now though I'm positive it'll get better. The characters seem pretty cool. But the gameplay...it feels like there's way too many systems going on. Affinity with NPCs, Affinity (coins?) with party members, Skill links, Party Gauge, Chains, Gem creation, random items scattered all over the ground for idk what reason, getting equipment drops with totally different stats and some being slotted or perma-slotted, weird targeting system, the whole random ""Press B for a morale boost, whatever that does!"" in battle... it feels like it's too much yet none of it totally goes over my head so I'm still enjoying it all. Also Gaur Plains theme is probably the best video game song ever made."
"Either way there's gender disparities, gender issues involved. Predicated on the fact women feel the need to be more attentive since they fear/will be seen as less than they are (even unconsciously) and guys who feel it's not masculine, that it's weak (so, feminine) of them to *have* emotional and mental health problems. "
"I still can't play a single game without the game crashing. I can't even alt-tab after that and have to either restart the pc or use Win + R to use taskkill (completely blind because i just see a black screen). 

Also the input lag is horrible and somehow my settings are always reset when i start the game (when it crashes + when i close it normally). So i also have to set everything to reduce the stupid input lag...

I have no idea how the XB and PC beta are so horrible after the really good PS4 beta...

Specs: I5-4590, R9 390, 8GB RAM, Win 10 Professional"
"As someone who introduced it to my GF, I'd recommend taking it at her pace. Dota2 can be overwhelming, because there's so much to learn. Let her do the tutorials, watch the vids (just youtube it, there's some great ones), watch the International with her, with commentary. They're great to explain, rewind and explain. GL"
"Even stopping to take photos, sightseeing along the way, keeping up a conversation with a friend. I'd be bored as fuck doing it for that long. At my slowest dawdle I walk at 3 miles an hour. Slowing down beyond that I just can't fathom. "
"Well, considering that even a diamond can be broken with a head-on collision with a bullet, the homeworld likely couldn't fight earth's armies head-on.
If the homeworld had tanks or artillery, or something of that sort, pack your bags."
"&gt; bringing it up just comes off as a stab against AJ

Because at this point this is the only thing WWE cares about. They've always been petty when it comes to bad terms with former employees. They would never acknowledge AJ and use her time with the company and her friendship with Paige on a storyline."
"http://imgur.com/QIeXtFD.jpg
I'm not trying to be greedy or anything but winning this would be nice. My specs are kinda shit tier but decent with an i5-2300, GTX 750 Ti and 8 gigs of RAM(couldn't download anymore ram). Sorry for the crusty pic and dusty pc but anyway thanks for the giveaway/congrats to whoever wins if I don't."
"Entitlement is a bitch huh. Poor people probably feel like they have a right to the contents of my savings account and retirement fund too.

After all it's fucking bullshit that I'm just leaving that money sitting there unspend."
"I don't mind thinking through an at-bat. David Cone does it on YES often, but seemingly every other sentence from Curt's mouth begins with *I*. We know you were a pitcher, Curt.     
He can discuss pitch sequences, locations and the like without constantly reminding us that he used to play the game.
It's about the guys on the field, not in the broadcast booth."
"Your submission has been automatically removed because your account is less than 30 days old. Please read the rules to learn more @ http://www.reddit.com/r/randomactsofcsgo/wiki/rules

*I am a bot, and this action was performed automatically. Please [contact the moderators of this subreddit](/message/compose/?to=/r/randomactsofcsgo) if you have any questions or concerns.*"
"&gt; Ironically I'm raised eastern and western, so I've grown up with an amount of fan service as you'd expect, but I notice it more and more the past 5-6 years than ever before because its somewhat exploded into popularity.

It seems we have similar backgrounds from that standpoint.

&gt;I think we hit a good middle ground honestly. Its not often on reddit you can discuss something without hurling abuse about

Completely agree. Great talking to you, and good luck on whatever development project you got going. "
"Full casters. I'm a huge fan of glass cannons and the like. As such, I prefer Sorcerers, Wizards, Warlocks, etc. and all their prestige and alternate-type classes. I grew up playing these types of games with my dad, who was either a paladin, big-ass fighter, or barbarian, so he always wanted a ranged fighter to help deal damage, and I always liked magic over physical prowess. 

This being said, I've been looking into Kineticist, so we'll see if I change a bit. "
"My game installed very quickly, that white bar before you even start the game you see in the PS menu. Yes because I figured the online servers are not online yet seeing as the game should not be out yet."
"At the risk of sounding like an asshole, isn't that kind of the point of having a new generation? Support for previous gens has to stop at some point. Can't really advance in the industry if you're still concerned with older technology.

Mortal Kombat 9 is on PS3/360. If you own an older system you have to get used to playing older games."
"That's kind of a weird song to defen. I mean, they literally said they hated generic pop (not that I don't love that song, but it isn't what most people who consider an example of ""the musical decline"")"
"Hmm, this may be a bit risky, but you could buy all the stuff first and then conduct a session with potential members. Then if they like the session and want to join the club, charge a membership fee. I don't know the college club that doesn't have a member fee. Usually like 15 dollars"
"Is there a UserVoice suggestion for it? If not, there should be. If we could get the votes of all the people who come to this sub, it would definitely make an impact. Now, I could create one and link to it here, but I don't want it to come off as some kind of voting scheme or anything."
"I couldn't agree more with your armor suggestions. Btw I am a huge fan of Army of One of the shotgun. So many times I have gotten a kill to juice my grenade recharge just in time for either a post-mortem or at the very least clutch chain damage.

edit: completely skipped over subclass design sections.... good work."
"#####&amp;#009;

######&amp;#009;

####&amp;#009;
 [**Tourism (Civ5)**](https://civilization.wikia.com/wiki/Tourism%20(Civ5\)) (from Civilization wikia): [](#sfw) 

---
&gt;__Tourism__ is a new gameplay stat in the *[Civilization V: Brave New World](https://civilization.wikia.com/wiki/Civilization_V:_Brave_New_World)* expansion pack, and the key to achieving the new [Cultural Victory](https://civilization.wikia.com/wiki/Cultural_victory_(Civ5\)). It is like the second, offensive part of the new Cultural system of the game - practically an offensive Culture, which affects exclusively the other civilizations, spreading your influence by cultural means. Its sources are unique works of art produced by your civilization, which rise above building a wonderful building, or making lots of theater plays and operas; as well as ancient artifacts dug out by your archaeologists, and then proudly displayed in your museums and Wonders. Their exceptional cultural value impacts other civilizations, spreading the glory of your culture and impressing them.
&gt;
&gt;^Interesting: [^Airport ^\(Civ5)](https://civilization.wikia.com/wiki/Airport \(Civ5\)) ^| [^The ^Internet ^\(Civ5)](https://civilization.wikia.com/wiki/The Internet \(Civ5\)) ^| [^City ^\(Civ5)](https://civilization.wikia.com/wiki/City \(Civ5\)) ^| [^Brazilian ^\(Civ5)](https://civilization.wikia.com/wiki/Brazilian \(Civ5\)) 

^Parent ^commenter ^can [^toggle ^NSFW](http://www.reddit.com/message/compose?to=autowikiabot&amp;subject=AutoWikibot NSFW toggle&amp;message=%2Btoggle-nsfw+cuj3ni8) ^or[](#or) [^delete](http://www.reddit.com/message/compose?to=autowikiabot&amp;subject=AutoWikibot Deletion&amp;message=%2Bdelete+cuj3ni8)^. ^Will ^also ^delete ^on ^comment ^score ^of ^-1 ^or ^less. ^| [^(FAQs)](http://www.reddit.com/r/autowikiabot/wiki/index) ^|  [^Source](https://github.com/Timidger/autowikiabot-py)
 ^(Please note this bot is in testing. Any help would be greatly appreciated, even if it is just a bug report! Please checkout the) [^source ^code](https://github.com/Timidger/autowikiabot-py) ^(to submit bugs)"
"I can see what you're trying to do. For me responding to people who reply to my ad forms part of the qualification process. I can get a glimpse early on of the personality of the tenant through an email or phone conversation. That would be lost if the process was too automated. "
"A panda walks into a bar and says to the bartender 'I'll have a Scotch and . . . . . . . . . . . . . . Coke thank you'.

'Sure thing' the bartender replies and asks 'but whats with the big pause?'

The panda holds up his hands and says 'I was born with them'"
"That and when they lost possession they would instantly and cynically foul to slow the game down so they could set their defence. Their game against Croatia set the tone for how they would be for this world cup.

I actually bet that Germany would beat them 4-0. They looked awful in some of their group games. It was a brutal, and hilarious, reality check for them."
Not to mention the other week I was in my local Gaming store when Sony rang them up and asked how many copies of until dawn they wanted the owner of the store said none the Sony rep asked why the store owner asked how he could be expected to sell product when the people he was buying it from were undercutting him
"Conniving people can trick you into leaving them alone with the child.  Conniving people can teach your child that THEY are the good ones and YOU are the baddie.  Conniving people can put up a good show for years so that you think they have changed when they really have only changed when you are watching.   

Of the regrets in my life, the biggest is that my children experienced abuse at the hands of their Ngrandparent before we realized that N had not changed.  Once realized, we didn't let her have them alone, but N only escalated abuse towards the family, and eventually chaos ensued.  If I had realized when they were babies that N was still N-ing at others, I would not have let her near them.   I wish I had.

We raise ""family"" relationships to almost holiness in this country.  If it is a good family, yes, have relationships with them.  But if what they are going to teach your child is that the child is worthless, or to be selfish pigs like N, or any other nastiness, then RUN AWAY.  "
"A girl I graduatedwith had a boyfriend that used to embezzle huge amounts of money using her bank account...she was convinced it was completely innocent, and that the money came from his job working 30 hours at a fast food restaurant."
"Daily reminder that this is the game's writer.

https://i.imgur.com/yIg74M7.jpg

Also Borderlands was only good from a gameplay perspective, it has little to no actually valuable lore to make a movie from. 

"
"According to a linked article Tom Mora was being let go.  Somsack Sikhounmuong from Madewell will be stepping into his place. 

I have mixed feelings about Madewell. I'll just have to see how it goes.

edit: typo"
"Bah, Brits are rude and aggressive, too. Just look at any of the videos with cyclists in them. Or that video of the van the other day.

https://www.reddit.com/r/Roadcam/search?q=%5BUK%5D&amp;restrict_sr=on&amp;sort=relevance&amp;t=all"
"It's even better on a motorcycle. The sounds. The smells. The wind on your body. How the bike leans and gravity pushes you around. Everything moving by.

Its the perfect scenario for the hyper focused mind. You go into a trance.

My therapist rides, too. "
"The thing that made it easier for me was to only cast SoF when you know that it will activate immediately.  Meaning, only click to cast it when you're in range.

If you do that, then right after you click, press Q.  You can practice against bots and stuff, it's important to be able to do, so just keep at it and you'll get it.  

I've never tried quick cast, I seeing the targeting circle is very important to me, so I don't think that would help."
"I do it because then the fuckers will never get them back, and that amuses me

EDIT: Okay, I said the above as a joke, then read the rest of the comments and it turns out people really do that. People are dildos."
"**PLEASE READ THIS MESSAGE IN ITS ENTIRETY BEFORE TAKING ACTION.  YOU HAVE FAILED TO ASK A QUESTION IN YOUR TITLE**

Your post was removed as it looks like you failed to ask a question in your title. Double check everything, including punctuation, and try posting again. 

* **If you're wanting to tell a story or explain something, please try /r/Self.**

* **If you're needing advice of any kind, try /r/advice or /r/needadvice**

* **If you're looking for a fact based answer, try /r/answers**

* **If you're looking for something that has slipped your mind, try /r/TipOfMyTongue.**

Anything else not covered try one of the subreddits mentioned in our sidebar that better suits your needs.

If you need more clarification, or feel this was an error, please contact the mods and provide a link to this post, thanks!


*I am a bot, and this action was performed automatically. Please [contact the moderators of this subreddit](/message/compose/?to=/r/AskReddit) if you have any questions or concerns.*"
"Then explain how we can have five dead children scattered about the new location, and have Foxy emerge from pirate cove (which doesn't exist at the new location) to find 5 dead children when phone guy says the animatronics are no longer allowed to walk around during the day and he doesn't think they even work any more:
https://www.reddit.com/r/fivenightsatfreddys/comments/3ir1lo/so_why_does_the_crying_child_cry/cuj3i0q"
"I don't, because we try to keep our Table Topics related to the meeting theme.

But one of the very first Table Topics questions I was ever asked in my very first club was about 100 duck-sized horses and one horse-sized duck, and the fighting thereof.

I felt very well prepared to answer."
"Warlocks definitely got shafted too, it's just not as bad overall because  warlock has multiple viable playstyles that will probably continue to be fine.  Definitely garbage for the most part though.  Honestly they really need to get WAY better at balancing warlock card power vs. drawbacks.  Wrathguard is just absurdly bad, that massive drawback in exchange for what exactly?  4/3 isn't even good stats.  Not to mention Demonfuse, jesus.  For the expansion itself warlock may very well have gotten the worst cards out of anyone.  At least rogue got some moderately interesting ones like beneath the grounds, burgle, and anub, and also got a pretty nice boost in arena.  Warlocks really just got absolutely nothing."
"On the other side of the spectrum I only have 6 months worth of programming experience, and that was just for a course. I did some minor stuff in Highschool but that isn't really worth mentioning. I only know how to code in python and some arbitrary mathematical modelling programs."
"So you mean to tell me that grown adults that lived their whole lives in the middle east, have trouble assimilating into a whole different culture with a different language and people who look nothing like you and don't have anything in common with you?!

Stop the god-damn presses. We got some fresh out of the oven breaking news right here. "
"I wouldn't say he was ever a career physicist but yeah, he did study nuclear physics and some of his work with the navy had to do with nuclear reactors. 

It's not that *nobody* comes to politics from the academia. It's just that most come from the legal profession and other sources like private businesses. "
"Thanks for your perspective.  I'm looking into getting my medical marijuana card (live in CA) and giving that a whirl.  It can't hurt, right?

If my loved ones were in charge, I would have had the fusion the day after the surgeon mentioned I was a candidate for one.  I think they're frustrated on my behalf and want to see me feel better.  They're all so hopeful that I'll be better and lead a normal life, but right now the risks don't outweigh the benefits in my eyes.  I'm trying to adapt to my new life and will continue to work on living a life in pain.  "
"Sorry, your submission has been automatically removed. This subreddit does not allow users to post singles. Please check out the rules before posting any more threads. If you're looking for feedback on a track check out the daily feedback thread.  


*I am a bot, and this action was performed automatically. Please [contact the moderators of this subreddit](/message/compose/?to=/r/makinghiphop) if you have any questions or concerns.*"
"**LIBERATION SPOILERS!!!** Spain in the 1500's  is full of expiration. Cortes, de Gama, etc. Since the movie's time period is **prior** to the exploration, I almost feel like we are going to get a set up for the exploration and conquest of Mexico and Peru. Remember, the Templar are looking for POE and temples, and where do we find a crap ton of literal temples? Central America! That's right, those of you playing at home, what if this movie is going to be ground work for a second movie to take us to central America to explore/destroy those temples? We know from Liberation that the Templar are excavating a Mayan temple in Mexico to find POE, so something has to push them in that direction, right? "
"Getting feedback is one thing, using it for anything relevant is another. Give some people a soapbox to yell from and they might have a warm fuzzy feel good vibe to appease them for a bit.

    &gt; /dev/null"
"Have you ever watched any of the App stuff they've done or Xaviers youtube channel? That's all them, WWE probably gives them a general direction or storyline point to hit but I highly doubt there's any serious writing involved with them. "
"Haha, are you mentally challenged? A foot isn't a stick you moronic fuck, still waiting on you to find an instance where someone was charged for punching or kicking someone in a sports match. Stick also doesn't equal helmet you fucking tard. Because a helmet couldn't be considered a weapon by any reasonable definition. "
"Adnan has lied about this part of the day almost as many times, if not more, than he has lied about the ride. At 12:43 he and Jay were south of WHS in the area where Hae's car would ultimately be found. "
