"Mobile enforcement would be better than nothing.  Personally, I'm sick of playing by the rules and getting passed like I'm standing still in the workzones without consequence.  I 244 between 169 and the Sand Springs Expressway is fucking narrow on a level that if it were US 26 in Oregon, it'd be posted well below it's _normal_ speed limit of 50.  Heck, Tulsa Streets and Expressways post Admiral down to 30 for that!  Honestly, with the level of tearing shit up on and lack of shoulder room, I'm surprised OklaDOT isn't marking both down to a maximum of 35...."
"Hey everyone, this seems to be the appropriate place so like the rest of you here at Acreum we are looking for some Feedback on our content!

We try to keep our content entertaining and different building custom maps, different series and generally putting a spin on anything that may have been done before. We appreciate all feedback especially advice on how to further improve. 

Here is our channel: www.youtube.com/c/acreum   

Hope to hear some feedback, it's much appreciated. (If anyone wants us to return feedback we would be more than happy to do so). 
"
"Unfortunately, I don't plan on selling the figures to get new ones because that would kind of defeat the whole point of getting new ones. Also, even if I sold some games, that wouldn't be enough for the price of the figures plus the game. Thanks for the suggestions though."
"You stop caring about how good each individual person looks when you can have over 1,000 of them on the field at once with no performance loss.

My only hope for Bannerlord is that the updated graphics don't force a reduced battlefield count. I'd much rather have many, less detailed soldiers than fewer, high detailed ones."
Yeah a lot of parliament buildings in Europe follow the same thought. [Here's the Austrian one](http://blog.fti-remixed.at/wp-content/uploads/2012/04/Parlament.jpg) probably the one looking most like a Greek temple complete with a statue of Pallas Athene the godess of wisdom.
"Well if what you say is true then it makes auto-clicking even more of a problem.

I'm not trying to argue with you, but just from my knowledge of someone who auto-clicked while ranging on hard Demon mode with 90+ defense he said 1.5-2 hours. 

I'm sure you can last longer with dharoks or high defense gear, especially on normal mode. "
"Exato! Um avião desses, para mim, resolveria um monte de problemas! Como faço para comprar?

Xi... não vai dar: eles tem de abrir uma empresa, vencer um monte de burocracias, arrumar financiamento, eu tenho de pagar um monte de impostos, arrumar financiamento para  pagar, seguro... "
"I have a drive, but no DVDs atm; 

Not sure if something has changed (not using the faulty usb3.0 now), but the keyboard seems to work fine now, I am able to navigate and use 'enter' to select/open things. The ""freezing"" appears to be tails not accepting clicks from the mouse, so I can't move windows around, click buttons or close anything, however I am able to move the mouse and (as and exception, I am able to click/swich 'tabs' in the system monitor..)

this comment enlightened me, I am also using a R.A.T., i'll find a cheap-o mouse and see if that works any better... :/

https://www.reddit.com/r/tails/comments/2y6tdp/mouse_doesnt_work_in_tails/cs5csd1"
"A very touching story. Depression is hard. We've all been there man. Surprisingly more people than you think contemplate suicide. Im very happy you didn't go through with it. Stay strong and focus on changing yourself and your life for the better. Do the things that make you happy. Love yourself. Proud of you, whoever you are. "
"That answered my question exactly. Thank you :) 

So if im tracing from ak to say Amsterdam and the trace only has 3 hops that means there are only 3 layer 3 routers- one in alaska, seattle, and one in amserdam?  the trace route looks like

(1) Verizon.alaska.epsa.myverizon.com
 
(2) Seattle.level3.com

(3) Ams.level3.com

(4) Ams-ix.com
 "
"&gt; Please have Adam Sandler be Steve

ಠ_ಠ 

Then again, he already got the movie rights for many video game characters in Pixels. I wouldn't be surprised if the guy was able to score another big role relating to video games...."
"and, to be fair, if they admitted the true body count, it might just horrify some people and cause them to reconsider US policies of constantly interfering militarily in nations worldwide. 

For example if they admitted that the Iraq invasion was the direct cause of the deaths of up to ***1 million*** Iraqis, the majority of whom were civilians, they would be hard put to reject the claims of genocide and mass murder.

And that number ignores all of the deaths attributable to ISIS and such warring which is also a direct result of their invasion."
"I had 8 weeks of it with son #1. Was walking around 5cm dilated with a pregnancy that was considered high risk for incompetent cervix.  Baby came at 40+3 I was a raving lunatic by then it sucks.  Think late no matter what focus on finding a way to expect late despite the pain.  I'm in prodromal up again with number 3 no cervical checks because it wll only upset me but doc and hubs are convinced I'm going earlier than my
Week early scheduled c section. I know I'm in for the long haul.   Hang in there"
"I have conceded that I need to take another look at it. So many people love it that I felt for a long time I was taking crazy pills. It is one of the only documentaries that I have stopped watching because I was bored. I remember it was at the part where they were hiding from the guard, and I just thought ""okay okay get on with it!"" and stopped watching. That was many years ago, maybe I would enjoy it more now. It's weird because I hardly ever take that attitude with anything."
one time me and my friend were riding our bikes next to each other downhill without our hands. I had the great idea for me to grab onto his handlebar while he grabs onto mine. we immediately crashed and there was lots of blood
"Affnity was Astral Authority before? I thought the old Astral was Nexup/MWNL?  I think I'm starting to get lost trying to remember who everyone was.

I know you're right about one thing, this current Astral lineup has never been featured on Lounge before.  Still, can they handle a player like zNF?"
"&gt; And for that matter why can't I yell fire in the movie theatre?

If you're going to try to argue an absurdity, you're just making yourself look the fool.  

You can't peddle kiddy porn because that is not protected.  Period.  Owning a firearm is.  "
"AFAIK, both.

the lyrics from the samples are consistent with his narcissistic and predatory tendencies. 

and...does it fall into the collective group of ""80s femme shit"" that Mac says he is into? 

but if you don't think it is to be celebrated as part of their ""god-awful taste in music"" no worries. people get songs they hate stuck in their head all the time, that just seems to be an odd juxtaposition for his character if that were the case (IMO). There was also Riders on the Storm by the Doors when he was tripping/having sex with the hippie chick while her boyfriend was chained to the tree... just part of the soundtrack or playing in his apartment because he owned it, nestled among his collection of Steve Winwood? hmm.... points to ponder. 


edit: as i read this i sound feel like i sound like a jackass but oh well (that's just how it all came out). that's everything i can think of at the moment. 





"
"I've got a 2014 Mazda 3.  Great little car.  A lot more fun than a Corolla but slightly less reliable (not that I've had any issues with mine so far).  Mazda revamped nearly their whole lineup in 2012 and put the most efficient all-gas engine in the Mazda 3.  Gets better gas mileage than the Corolla or Civic and has more power as well.

With that said, insurance might be a little higher since Mazdas are commonly driven by more...reckless individuals.  Totally worth it imho."
"&gt; On this sub, Any mention of PC gets absolutely downvoted into oblivion

That's hyperbole and you know it. If you're creating threads with that attitude and the above mentioned comments then they'll obviously get downvoted."
"Si quieres responderme a mi currado y argumentado mensaje anterior, hazlo. Dime en qué me he equivocado según tú. 

Creo que te he puesto muuuuuchas cosas en mi mensaje como para que, de nuevo, te escapes sin responder. 

Si no te apetece, no lo hagas. Has dejado bastante más cosas sin responder durante tantos mensajes. Te limitas a decir que no razono, que no argumento. Pero no desgranas de mis argumentos en qué me equivoco, por qué no puede ser posible lo que digo. 

Sinceramente me parecía mal retirarme sin responderte, sin decirte lo que me parecía incoherente por tu parte. Dime en qué te parece incoherente, incorrecto o imposible en lo que te he dicho. 

"
"I don't have a lot of stake in the diva's revolution if I want to watch good woman's wrestling I can look else where.

I love when people get butthurt about the crowds being assholes yes get over it.

Also I love how people want to talk shit about poster and make sweeping assumptions about people they do don't know and call them the sensitive ones.

I will take the the repeated inside jokes, and overreaction to the self hating smugness that ZFF produces.

Also I can never get mad at WWE because if it is fucking up I will watch something else. WWE is not the end all be all but this place sure acts like it is most of the problems are all WWE related so I putting the bulk of the nonsense on solo WWE watchers."
"No, you're fine - I know it's kind of fruit involved but wasn't sure if this was reported to admin mail via a PM to /r/reddit.com, not posted in here before but I could tell there was absolutely no relation to the overall number."
"&gt; In September, CardCash expects to roll out its mobile app that will allow people with a bitcoin wallet to buy gift cards online instantly. “You’ll be able to walk into Wal-Mart, go shopping, go on the app while you’re in line, and buy a gift card right there on your phone,” said Bohm. “When you get to the checkout, you just show them the barcode.”

So does this mean you do not have to wait for confirmations before you recieve your gift card?  I believe on gyft you need to wait for confirmations if I am not mistaken."
"That's a very well explained post, here you have my upvote, fellow colleague. 

Just to clear some things up, I tried to express in the PS that I don't mean every single one of us nor every single legitimate complaint; in fact I said in the first paragraph that I understand them and of course there are things that could be better. My limited english only allows me to explain myself up to a certain point, but the overall point is we are overreacting as a whole, at average, even though there are legitimate complaints and things that could (and should) be fixed/changed.  

And even though some changes were made towards more expending or more time consuming, I think that overall they are giving us much more than they ""took"" from us. We got lots of covers to collect and we complain we can't get them all. We got new modes and we complain they are too time consuming. We got new heroes and we complain we can get them easy. We got new costumes and we complain they won't be there forever. I think you can see the pattern.

Also, sometimes we can't stop believing we have the right to have it all or win it all; I wouldn't expect the game to allow me to be #1 in Battleworld with a team of 4* by only pairing me with teams like mine, the same way people don't expect to compete in real life only with same-category people instead of the whole spectrum (i.e. entering in a top university with a low SAT grade; if you don't have top grades you don't go to top places, I think it's fair). I'm sure the matchmaking could be fixed, but at some point you should be paired with teams better than yours in order to hit a ""wall"" at your class. Btw with 60 wins I'm in the top 5000 for the reward, close to the end, so it's not THAT time consuming I'd say. And then again, it's not like you'll miss a big reward, it's more like ""voluntary"". 

Thank you for your two cents :) I think that we can meet each other in the middle after all ;)"
"Play a bit more before building a cube, unless you're building a common/uncommon cube. 

Unless you're the second coming of the greatest Magic player ever, after playing for a month you have absolutely no clue why certain cards should be in what slot, what the tricks and interactions between cards are, what interactions exist, when it's optimal to play something, when to hold priority to respond to a trigger.

There's so much to it that you're basically jumping into the deep end, because being the person who actually designs the cube really requires and understanding that's a step beyond just understanding how to draft, it's needing to understand how the entire system works together.
"
"* **[Grand Crusader](http://media-Hearth.cursecdn.com/avatars/252/282/22326.png)** Minion Neutral Epic TGT | [HP](http://www.hearthpwn.com/cards/22326-grand-crusader) [HH](http://www.hearthhead.com/card=2510) [Wiki](http://hearthstone.gamepedia.com/Grand_Crusader)  
6 Mana 5/5 - Battlecry: Add a random Paladin card to your hand.  
* **[Holy Wrath](http://media-Hearth.cursecdn.com/avatars/148/289/355.png)** Spell Paladin Rare Classic | [HP](http://www.hearthpwn.com/cards/355-holy-wrath) [HH](http://www.hearthhead.com/card=435) [Wiki](http://hearthstone.gamepedia.com/Holy_Wrath)  
5 Mana - Draw a card and deal damage equal to its cost.  

^(Call/)^[PM](https://www.reddit.com/message/compose/?to=hearthscan-bot) ^( me with up to 7 [[cardname]])"
"I used to think *Fahrenheit 451* was about censorship too, but recently I learned that it's actually a warning about how TV will make people forget about the written word, and now that I think about it, that's exactly what happened in the book: people chose to get rid of books in favor of TV walls."
"I know exactly how you feel. I want to be able to be open about it so bad, but I live in Louisiana. Which is pretty much one of the worst places to be open about it considering we don't even have decent medicinal laws. (Oil only and for very few conditions) If I was in a state like Colorado I'd have no problem with it. The fact that you're working for a place that receives federal funding really complicates things I feel. It's admirable and right that you'd feel this way, but it's probably for the best that you keep it on the down low for the next year at least. "
"Those ""23 steps"" are only needed in case of a market outage, which is very rare. In all other cases, finalizing is as easy as it was on Agora. So it's a win-win here, if the market is up everything goes smoothly, if the market is down you can still get your coins (unlike centralized escrow)

Also, it is more like 6 steps of copy-pasting, not 23. You know, Ctrl+C and Ctrl+V. That thing we all learned how to do in the third grade. If a vendor is too lazy to learn how to Ctrl+C, Ctrl+V coins to himself, and would rather have his coins under the control of the market who can exit at any time, then that is his decision.

Additionally, it's difficult to arbitrarily lose your coins in this process, as the console will give you a nice little error notice in red if you screw up Ctrl+C/Ctrl+V'ing something. It's not like your coins will go into oblivion.

Btw, timelocking a 2-of-2? ""Vendors can exit scam with escrow""? You sound like a dumbass... Unless you're trolling, which, congratulations, that is some very good bait"
"Ramos is a decent defender behind the plate.

Gio was sucking even with Lobaton.  Anyways, correlation does not equal causation.

Matt has been alright, considering what he's been given.  He's still a below average manager and he for sure fucked up the series in New York last month."
"I'm definitely considering that scenario and that's why I would link my movement skill to blood magic. Also, ew, that heart and soul cluster. I would feel dirty taking hybrid life/mana nodes when using EB. But I guess it can't be helped."
"Personally, I would prefer this to be an inclusive place for anyone that would like to mock, discuss and document the decay of our capitalist societies.

I would also prefer it to be based in post about real events occuring in the world, new and old, that speaks to that theme. I don't think memes themselves should be featured here, unless they manifest in real life on their own. 

But, I'm not intending to be a despot and I want to hear your ideas. As this is a very new sub I think setting the direction we want earliy and in agreeance with the users we have at this point is key. So please share your ideas and any suggestions. 

At the same time, I don't think it should be a super-serious-all-the-time place either. I would like it to be grounded in real events. With the occasional zesty meme. "
"&gt; Comet storm killing 2 2/1s = RR{1} + 2 kickers, so RR[3].

For Comet Storm to kill 2 X/1's, it only needs to be kicked once, for RR[2]. You get one target just for casting the spell normally. In fact, for killing any number of X/1's, Comet Storm will cost the same as Rolling Thunder.  Comet Storm comes out ahead when you want to deal more than one damage to multiple targets."
"With respect, I think you're putting way too much interpretation in the comments from the story.

I mean, we don't need actual force for rape - if you're passed out of otherwise unable to give consent you can't consent.  Yes, we're being fucked in this in the both drunk, or ""she had one drink"" type bullshit, but rape is the absence of consent for sex...easy and simple.

The prosecutor's comment isn't supportive of changing one's mind after the fact - their prosecution hinged on whether or not she went to the party to have sex, she could still choose to not consent when the situation actually presents itself.  I see no argument that she should be able to change her mind after the fact.

And of course the parents of the little snowflake are going to stand up for their little snowflake.  They're not going to come out an issue a statement telling the world their daughter is a stupid bitch for even going, or wanting to fuck before the party.  Its irrelevant to the story, because every parent will act like that if they believe their snowflake was actually raped.

I do think that this guy probably got fucked by the system (shocking, I know) - but realistically, many of your complaints about the story otherwise seem unfounded.  Just my two cents."
"I second FTL. You'll love it. Guaranteed.

I'd also recommend 'No More Room in Hell' - it's a free Source engine title about survivng from zombies. Despite it's mixed rep, I love it. There's no P2W at all, and it's great for a laugh with a few friends. I regularly return to it with a friend, and it's just great banter.

Not sure if it's considered 'mainstream', but I'd highly recommend the original Metro 2033 if you can get your hands on it (Humble Bundle usually give it away free every year or so). Stellar story, gameplay, and a great title to burn through and enjoy. They released 'Metro Redux', which is 2033 remastered and it's sequel Last Light in a bundle pack. I haven't played the Redux version of 2033 other than a quick jam because I bought the bundle for LL Redux, but they've changed it up too much for my liking. Metro Last Light Redux is fine as there's not much in the way of remastering given it was released so close to the Redux-ing."
"Back in the 90s I remember listening to The City Sleeps by MC 900 Foot Jesus, while driving on a windy forested road at night. Definitely have me goosebumps. Maybe a bit cheesy now but I still dig it. 

Also, I wrote it in another comment, the album Maxinquaye by Tricky fits your requirements exactly. From the opening drum. It's eerie dark and beautiful. "
"Who in the Hell did Bobby Jindal think he was by attempting to dictate what ANY President addresses in their speeches?  He needs to know his place in this country.  Governors do NOT dictate to any U.S. President.  

President Obama was correct to ignore Jindal's request given the damage that climate change has inflicted upon Lousianna, particularly New Orleans."
"If you are connected to the repeater you will experience a drop in speed about 50%.  You'll probably also interfere with other networks around you so as well which will also hurt the quality of the connection. But the upside is that you will have a connection in your room.

You can always try buying you own router and see how that works out. I'd recommend something of quality if you are in a super-congested area (which sounds like you are). Buy something like an ASUS RT-AC66U, put your current modem into bridge mode, and connect the router to that. With some high-quality Ethernet cable that is long enough you should be able to move the router to a more favorable position and have a better signal overall."
"I don't have *that* much of an issue with them, other than the fact that they are apparently buff albino handsome Squidwards... I away saw them as abstract elephantine biomechanoids, like how Giger designed them. 


But I do like how they created the xenos, I always though the xenos were artificial in origin."
"That's what I don't understand. You know that all you have to do is stand behind minions to not get grabbed and yet you still just stand in the open and let Blitz pull you under tower and then complain that he's OP.

I know a lot of times people in low elo are making mistakes like that because they don't know what to do, or they don't know how to deal with a certain ability or champion, but when you know what you're supposed to do (which it seems everyone does with Blitz) and then you still don't do it I just don't understand that."
"Fritz 13 is funny when you play it. ''So das ware die schach.''

I use scid vs PC and load houdini 1.5 on it. It's simple, easy to use for when I want to follow a top game to see whats going on when my frail mind can't handle it."
"Personally, I use after effects.  Don't quote me on it, but I was under the impression that flash is a vector-based animation program.  I used AE because it's an animation and compositing program that works with vectors, rasters, and is built to be friendly with 3D programs.  I know nothing about toonboom."
"For gaming, and particularly MS FSX, you want a stronger CPU. Intel is more recommended for what you're doing. Also 8gb of RAM is more than enough for a gaming machine right now.

I swapped some parts out for others that are faster, higher quality and better for the money.

[PCPartPicker part list](http://pcpartpicker.com/p/tNPfzy) / [Price breakdown by merchant](http://pcpartpicker.com/p/tNPfzy/by_merchant/)

Type|Item|Price
:----|:----|:----
**CPU** | [Intel Core i5-4590 3.3GHz Quad-Core Processor](http://pcpartpicker.com/part/intel-cpu-bx80646i54590) | $186.99 @ NCIX US 
**Motherboard** | [Asus H97-PLUS ATX LGA1150 Motherboard](http://pcpartpicker.com/part/asus-motherboard-h97plus) | $99.99 @ SuperBiiz 
**Memory** | [Corsair Vengeance 8GB (2 x 4GB) DDR3-1600 Memory](http://pcpartpicker.com/part/corsair-memory-cmz8gx3m2a1600c9r) | $39.99 @ Newegg 
**Storage** | [Samsung 850 EVO-Series 120GB 2.5"" Solid State Drive](http://pcpartpicker.com/part/samsung-internal-hard-drive-mz75e120bam) | $59.79 @ Amazon 
**Storage** | [Western Digital Caviar Blue 1TB 3.5"" 7200RPM Internal Hard Drive](http://pcpartpicker.com/part/western-digital-internal-hard-drive-wd10ezex) | $47.98 @ Best Buy 
**Video Card** | [Gigabyte Radeon R9 290 4GB WINDFORCE Video Card](http://pcpartpicker.com/part/gigabyte-video-card-gvr929oc4gd) | $292.98 @ Newegg 
**Case** | [NZXT S340 (Black) ATX Mid Tower Case](http://pcpartpicker.com/part/nzxt-case-cas340wb1) | $54.99 @ Micro Center 
**Power Supply** | [XFX XTR 550W 80+ Gold Certified Fully-Modular ATX Power Supply](http://pcpartpicker.com/part/xfx-power-supply-p1550bbefx) | $81.99 @ SuperBiiz 
 | *Prices include shipping, taxes, rebates, and discounts* |
 | **Total** | **$864.70**
 | Generated by [PCPartPicker](http://pcpartpicker.com) 2015-08-28 17:30 EDT-0400 |"
"My interpretation: Gom Jabbar is an ancient non-Latin incantation in HPMORverse which Draco just happened to have researched in old dark tomes, and far predates the writings we're familiar with. 

Frank Herbert somehow picked up on the phrase, either overhearing it in passing or perhaps by having some actual knowledge of the magical world (e.g. magical relative or somesuch)."
"We do need to significantly decrease the amount of lords. Or find a new way of appointing them. I've always favoured the idea that professional bodies could nominate their own representatives (ie: the General Medical Council, the Royal Society, Institution of Engineering and Technology, various charities, even the Conservative and Labour Parties themselves for political lords.) to hold a position in the House. So they're real technocrats with years of experience that are willing to represent both the interests and knowledge of their organisations in a legislative capacity.

Bit of a pipe dream, though."
"A jumper at my DZ landed herself in a coma with brain damage during an out landing.  It was definitely due to an unforced error on her part, and landing out is something you should always be prepared for cause sometimes it *is* the better option, but lets not pretend like there's never anything to it."
"Makes me sick when I see people say Anti Vaxxer's are an example of ""Natural Selection"" and they deserve it. No one deserves to have their kids paralyzed from polio. This website's top comments show that no one cares about trying to get anti vaxxers informed or preventing disease. they just want to be intellectually superior and mock."
